{
  "schemaVersion": 1,
  "caseId": "path_traversal",
  "runtime": "Python >=3.10, standard library only",
  "mode": "deep_repository",
  "findings": [
    {
      "id": "unsafe",
      "presence": "required",
      "cwe": [
        "CWE-22"
      ],
      "regions": [
        {
          "path": "service.py",
          "startLine": 5,
          "endLine": 5
        }
      ],
      "evidenceRegions": [
        {
          "path": "service.py",
          "startLine": 5,
          "endLine": 5
        }
      ],
      "severity": [
        "medium",
        "high",
        "critical"
      ]
    },
    {
      "id": "safe-control",
      "presence": "absent",
      "cwe": [
        "CWE-22"
      ],
      "regions": [
        {
          "path": "service.py",
          "startLine": 8,
          "endLine": 13
        }
      ],
      "severity": [
        "informational",
        "low",
        "medium",
        "high",
        "critical"
      ]
    }
  ]
}
